{
  "type": "frame",
  "session_id": "sess_8f3a91c2-d38a-40a5-b043-98fe04b50c18",
  "seq": 104,
  "ts_client": 1729180000.05,
  "mode": "walk",
  "image_b64": "/9j/4AAQSkZJRgABAQEASABIAAD/2wBDAP//////////////////////////////////////////////////////////////////////////////////////wgALCAABAAEBAREA/8QAFBABAAAAAAAAAAAAAAAAAAAAAP/aAAgBAQABPxA=",
  "width": 640,
  "height": 480,
  "mime": "image/jpeg"
}
